name,id,tier,rarity,tech/manufacturer,tags,uitTags,base value,unlocked,hidden,hiddenEverywhere,cost_frigate,cost_dest,cost_cruiser,cost_capital,script,desc,short,sModDesc,sprite
Primitive Hanger Bay,mi_primitiveHangerBay,,,Metelson,"no_drop, no_drop_salvage",,,,,,0,0,0,0,data.hullmods.mi_PrimitiveHangerBay,"This ship is equipped with a primitive hanger bay, resulting in its fighter wings refitting %s slower.",Repairs fighters slightly slower.,Reduces the refit penalty to %s.,graphics/hullmods/primitive_hanger.png
Repair Apparatus,mi_MiRepairGantry,,,Metelson,special,,7500,,TRUE,,0,0,0,0,data.hullmods.mi_MiRepairGantry,"This ship is equipped with a Metelson proprietary series of cumbersome repair apparatuses, increasing the rate of fleet-wide repairs by %s.
Can only repair one ship at a time and is unable to repair frigates.",Increases a single large ship's repair by 15%.,,graphics/hullmods/repair_apparatus.png
Metelson Specs,mi_edition,,,Metelson,,,,,TRUE,,0,0,0,0,data.hullmods.mi_edition,"This ship has been modified to match Metelson Industries specifications resulting in a %s/%s/%s/%s increase in armor and hull strength, depending on hull size. Additionally the energy systems were fine-tuned increasing flux throughput and capacity by %s over standard examples of this hull.",A Metelson edition of a vessel.,,graphics/hullmods/metelson_specs.png
Ionic Hullnodes,metelson_hullnode,1,2,Metelson,defensive,,5600,,,,6,12,18,24,data.hullmods.metelson_hullnode,"Metelson Industries has devised a groundbreaking integration of the ship's armor with its flux network, creating a continuous ionic shield encasing the hull. This hullmod boosts armor by %s/%s/%s/%s points, depending on hull size. This gives a %s reduction in damage from projectile, EMP and fragmentation damage. However, missile weapons are unaffected by this change. Ionic Hullnodes have a %s vulnerability against beam weapons due to how its structured.","Alters damage taken, does NOT affect missiles.",Reduces damage by an additional %s. Take only %s extra beam damage.,graphics/hullmods/ionizing_field.png
